{
    "title": "Sempiternal Beings",
    "album": "Fauna",
    "artist": "Haken",
    "time_signatures": [
        {
            "numerator": 7,
            "denominator": 8,
            "measures": 36,
            "bpm": 260
        },
        {
            "numerator": 13,
            "denominator": 16,
            "measures": 1,
            "bpm": 520
        },
        {
            "numerator": 47,
            "denominator": 16,
            "measures": 1,
            "bpm": 520
        },
        {
            "numerator": 13,
            "denominator": 16,
            "measures": 1,
            "bpm": 520
        },
        {
            "numerator": 47,
            "denominator": 16,
            "measures": 1,
            "bpm": 520
        },
        {
            "numerator": 13,
            "denominator": 16,
            "measures": 1,
            "bpm": 520
        },
        {
            "numerator": 16,
            "denominator": 16,
            "measures": 1,
            "bpm": 520
        },
        {
            "numerator": 31,
            "denominator": 16,
            "measures": 1,
            "bpm": 520
        },
        {
            "numerator": 13,
            "denominator": 16,
            "measures": 1,
            "bpm": 520
        },
        {
            "numerator": 47,
            "denominator": 16,
            "measures": 1,
            "bpm": 520
        },
        {
            "numerator": 15,
            "denominator": 16,
            "measures": 4,
            "bpm": 520
        },
        {
            "numerator": 7,
            "denominator": 8,
            "measures": 24,
            "bpm": 260
        },
        {
            "numerator": 13,
            "denominator": 16,
            "measures": 1,
            "bpm": 520
        },
        {
            "numerator": 19,
            "denominator": 16,
            "measures": 1,
            "bpm": 520
        },
        {
            "numerator": 13,
            "denominator": 16,
            "measures": 1,
            "bpm": 520
        },
        {
            "numerator": 19,
            "denominator": 16,
            "measures": 1,
            "bpm": 520
        },
        {
            "numerator": 13,
            "denominator": 16,
            "measures": 1,
            "bpm": 520
        },
        {
            "numerator": 19,
            "denominator": 16,
            "measures": 1,
            "bpm": 520
        },
        {
            "numerator": 13,
            "denominator": 16,
            "measures": 1,
            "bpm": 520
        },
        {
            "numerator": 19,
            "denominator": 16,
            "measures": 1,
            "bpm": 520
        },
        {
            "numerator": 15,
            "denominator": 16,
            "measures": 16,
            "bpm": 520
        },
        {
            "numerator": 8,
            "denominator": 16,
            "measures": 1,
            "bpm": 520
        },
        {
            "numerator": 6,
            "denominator": 16,
            "measures": 1,
            "bpm": 520
        },
        {
            "numerator": 10,
            "denominator": 16,
            "measures": 2,
            "bpm": 520
        },
        {
            "numerator": 6,
            "denominator": 16,
            "measures": 1,
            "bpm": 520
        },
        {
            "numerator": 6,
            "denominator": 16,
            "measures": 1,
            "bpm": 520
        },
        {
            "numerator": 10,
            "denominator": 16,
            "measures": 2,
            "bpm": 520
        },
        {
            "numerator": 6,
            "denominator": 16,
            "measures": 1,
            "bpm": 520
        },
        {
            "numerator": 6,
            "denominator": 16,
            "measures": 1,
            "bpm": 520
        },
        {
            "numerator": 10,
            "denominator": 16,
            "measures": 2,
            "bpm": 520
        },
        {
            "numerator": 6,
            "denominator": 16,
            "measures": 1,
            "bpm": 520
        },
        {
            "numerator": 6,
            "denominator": 16,
            "measures": 1,
            "bpm": 520
        }
    ],
    "initial_offset_ms": 200
}